,author,date,text,upvotes
51,Derys Lyttle,15h,"Absolutely not. Nothing can ever replace the individuals intention, interpretation and execution. However: it might make Authenticity harder to discern for the general population. This could have both negative and positive effects on value and sale ability.",
52,Sasha Prylypska,Aug 15,"I don’t think it will. When it comes to art, there is a huge difference in admiring something a human has made and something that was generated by AI",
53,Felix Emanon,Nov 23,"AI is to art what fast food is to the culinary world, just crap, run of the mill, dime a dozen that can be done by anyone. REAL art requires a real artist.",
54,Pedro Rocheteau,Dec 8,"It depends on how you look at it, and where your values stand. If you think art should be less elitist, more accessible and overall democratized, then the “AI revolution” would be considered a good thing for the industry. But we would have to deconstruct “industry” too. Many people still think artists are some kind of divine entities, and that art is and should be something “sacred” - I don’t think AI will help perpetuate those ideals at all. This is a really nuanced topic though, especially since we’re speaking about something as impactful as art. Everyone has a unique relationship with art, and… (more)",
55,MEMATRON,Dec 22,Put it this way. If you’ve used Photoshop within the last 15 years you’ve use A.I. in your work. The problem isn’t if A.I. will ruin art. The people that need to be concerned are all of the talentless hacks that rely on A.I. to do all of the work for them. I’m not defending it and I’m not attacking it. I’m saying that if you can’t make art without the aid of a computer then you’re not really an artist. You’re as much a tool as the tools you use. PUT THAT IN YOUR DATABASE. :),1
56,Aditya,Dec 23,"It is unlikely that AI will completely kill the art industry, but it may change the way art is created and consumed. AI has the potential to revolutionize the art world by enabling the creation of art that is more realistic, expressive, and varied than what is possible with traditional methods. However, it is important to note that AI is a tool, and like any tool, it can be used in a variety of ways. Some artists may choose to incorporate AI into their work, while others may prefer to work with traditional methods. It is also possible that AI may be used to augment the work of artists, rather t… (more)",
57,Priyanka Sahu,Dec 24,"Artificial intelligence (AI) is a type of technology that can be used to do things that would normally require human intelligence. Some people think that AI might one day be able to do things that are currently done by people in the art industry, such as creating art or deciding what art should be shown in a museum. However, it is unlikely that AI will be able to completely replace the art industry. This is because many people value art for the way it can express emotions and ideas, and AI cannot do this in the same way. Additionally, there are many other factors that contribute to the value o… (more)",
58,Mika Vehns,Jan 2,"While AI has the potential to revolutionize and disrupt various industries, it is unlikely that it will completely kill the art industry. AI technology can be used to create art pieces or assist artists in their creative process, but it cannot fully replicate the unique perspective and emotion that humans bring to their art. There will always be a demand for human creativity and expression, and the art industry will continue to evolve and adapt to new technologies. However, it is possible that AI may change the way art is produced and consumed, potentially affecting certain job markets within … (more)",
59,SKULL艾 CRUSHER,Jan 2,"There are a number of ways that AI could potentially impact the art industryAI could be used to create new forms of art that would not be possible without the use of technology. For example, some artists are using AI to generate music, paintings, and other forms of visual art.AI could be used to automate certain aspects of the art industry, such as the production and distribution of art. This could potentially make the process of creating and selling art more efficient, but it could also lead to job displacement in certain areas of the industry.AI could be used to analyze and understand art in… (more)",
60,Wallpapers 8k,Jan 5,"It is difficult to predict the exact impact that artificial intelligence (AI) will have on the art industry in the future. While AI has the potential to revolutionise various aspects of the art industry, it is unlikely to completely replace human artists. Read More….… (more)",
61,Aditya Pandey,Jan 7,"It is unlikely that artificial intelligence (AI) will completely replace the art industry. While AI has been used to create some impressive works of art, such as music and visual art, it is unlikely to completely replace the creativity and human touch that are central to the art world. There is also the question of whether AI-generated art can truly be considered ""art"" in the same way that human-created art is. Some people believe that the unique perspective and emotion that humans bring to their art is an essential part of what makes it meaningful and valuable. That being said, it is possible t… (more)",
62,Manish Kumar,Jan 10,"I think It is unlikely that AI will kill the art industry, but it may change the way art is created, distributed, and consumed.On the one hand, AI has the potential to enhance the art-making process by allowing artists to create new types of works that would be difficult or impossible to make by hand. For example, AI algorithms can be used to generate unique paintings, sculptures, and even music compositions. This can open up new opportunities for artists and make art more accessible to a wider audience.On the other hand, the use of AI in art also raises questions about the definition and valu… (more)",
63,Ehtsham ul Haq,Jan 15,"It is unlikely that AI will kill the art industry, but it may change the way it operates. AI has the potential to assist artists in creating new and unique works, as well as help to speed up and automate certain aspects of the creative process. However, it is important to note that AI-generated art is not the same as human-generated art, and it is likely that the value placed on human-created art will always be different than that of AI-generated art. Additionally, AI can also be used in the art industry to help with tasks such as conserving and restoring artworks, authenticating art, and iden… (more)",
64,Sebastyan Papp,Jan 18,"There is no doubt that artificial intelligence (AI) is rapidly evolving and growing more sophisticated every day. With its ability to learn, grow, and adapt, AI has the potential to completely change the way we live and work. This includes the art industry, which has already begun to feel the impact of AI. Some experts believe that AI will eventually replace human artists altogether, as it will be able to create perfectly realistic artworks that are indistinguishable from those created by humans. Others believe that AI will simply augment the art industry, assisting human artists in creating ne… (more)",
65,Pradox,Jan 21,"AI has the potential to change the way art is created, exhibited, and consumed, but it is unlikely to completely replace the art industry. AI-generated art has been used to create unique and interesting pieces, but it is still largely considered a new and experimental medium. Many people still value the creativity, skill, and human touch that goes into traditional art forms. Moreover, the art industry is not just about creating art, but also includes the curation, promotion, and selling of art. These aspects of the industry are likely to continue to be driven by human creativity, expertise, and … (more)",
